{
  "$schema": "../../../schemas/bonvoyage-authoring-snippets-v1.schema.json",
  "schema_version": 1,
  "classification": "routesphere-bonvoyage-configuration-snippet-catalog",
  "snippet_version": "bonvoyage.configuration-snippets.v1",
  "contract_version": "bonvoyage.configuration-authoring.v1",
  "compiler_version": "bonvoyage-control-plane-phase4-admin-v1",
  "configuration_schema_version": 1,
  "authority": {
    "semantic_validation": "snapshot.Compile",
    "snippet_scope": "reviewed-syntactic-starting-points-only",
    "insertion_authority": "consumer",
    "validation_required_after_insertion": true,
    "network_access": false,
    "live_mutation": false
  },
  "security_boundary": {
    "offline": true,
    "secret_values_included": false,
    "secret_references_may_be_included": true,
    "environment_secret_reads": false,
    "private_material_included": false
  },
  "sources": {
    "authoring_contract": {
      "path": "config/authoring/bonvoyage-authoring-v1.json",
      "sha256": "098b41f7a57ac3eadff59137b358df8aaf5e6bd5759639f2beaa5b81b39dcebf"
    },
    "completion_metadata": {
      "path": "config/authoring/completion/v1/metadata.json",
      "sha256": "9bf0e31afd8725c11d7ac1e56aa0a82df7c607a810cafa7aa8f54c6578060430"
    },
    "reviewed_source_manifest": {
      "path": "config/authoring/snippets/v1/reviewed-sources.json",
      "sha256": "58174edec3cbb25bb7aed1f8fcda3bde88b0f6e08a4bf3908685b28f1f84eaad"
    }
  },
  "source_document_count": 12,
  "source_documents": [
    {
      "path": "config/examples/local.yaml",
      "sha256": "f8fd66340d769ee505e4135e0cabd713e338b9fc8323ba1d9c21e28ecc03e4a8"
    },
    {
      "path": "config/examples/tls.yaml",
      "sha256": "1cabf7e80599ff06924f3db511cf2b340d9adccc860c343edefb0083686e071c"
    },
    {
      "path": "config/examples/upstream-tls.yaml",
      "sha256": "ed9925d1fa73f1d49e695311deb42f18934424cf496650ede1dbf42bae3ff317"
    },
    {
      "path": "tests/fixtures/phase3-api-key.yaml",
      "sha256": "6e400dfa5f617bd3ce8bd66bd3a31b438c95cf80c71e9fa201f89326a70ec3ca"
    },
    {
      "path": "tests/fixtures/phase3-cors.yaml",
      "sha256": "a4da2371bde1da956b35faf0beb32460dbe44b848128cf454874a8e3d9af4ed9"
    },
    {
      "path": "tests/fixtures/phase3-header-transformations.yaml",
      "sha256": "715e3ee392c55d3004d1b756ef13fd7af9f63e5c09fd8d9948d9261022e19b10"
    },
    {
      "path": "tests/fixtures/phase3-jwt.yaml",
      "sha256": "4ef9c354d4071d17b144c95b549bf4aeee8ca30dc868f520ca4e469f119b7f9e"
    },
    {
      "path": "tests/fixtures/phase3-redirect.yaml",
      "sha256": "e32f20d6b7e9f526050f22e6a40c58e704904e0b6475a8ed7e97906a7a570897"
    },
    {
      "path": "tests/fixtures/phase3-request-content.yaml",
      "sha256": "890048221b4313d96e01d17d9c8f7931988e9ef6b5766ac73dc65982dda39c9c"
    },
    {
      "path": "tests/fixtures/phase3-route-admission.yaml",
      "sha256": "98f990af5319ab6bfb423b81041f76234706ad88e3005f38006e6a9b56c05406"
    },
    {
      "path": "tests/fixtures/phase3-route-rewrites.yaml",
      "sha256": "e145ef6a3f7480c8e5401345f8aba5515d984e4b63216d90e394f8a7c0430854"
    },
    {
      "path": "tests/fixtures/phase3-weighted-traffic-splitting.yaml",
      "sha256": "d82913c24f15cc674ea0a07f7ce726fae0fdc6929fd91afbeaf79ae1f262c421"
    }
  ],
  "entry_count": 14,
  "entries": [
    {
      "id": "cluster-upstream-mtls",
      "title": "Upstream TLS and mTLS",
      "summary": "Add server identity verification and an optional client certificate to one upstream cluster.",
      "category": "transport",
      "source": {
        "path": "config/examples/upstream-tls.yaml",
        "pointer": "/clusters/0/upstream_tls",
        "sha256": "ed9925d1fa73f1d49e695311deb42f18934424cf496650ede1dbf42bae3ff317"
      },
      "insertion": {
        "container_path": "/clusters/*",
        "mode": "merge-object"
      },
      "payload": {
        "upstream_tls": {
          "server_name": "backend.internal.example.com",
          "trust_bundle_secret": "backend-ca.pem",
          "certificate_chain_secret": "gateway-client.pem",
          "private_key_secret": "gateway-client-key.pem"
        }
      },
      "yaml": "upstream_tls:\n  server_name: backend.internal.example.com\n  trust_bundle_secret: backend-ca.pem\n  certificate_chain_secret: gateway-client.pem\n  private_key_secret: gateway-client-key.pem\n",
      "yaml_sha256": "549719e5a15c8909914f98fc1c62a097b36dd63c0f427e2acf1a633765b19896",
      "edit_points": [
        {
          "payload_path": "/upstream_tls/certificate_chain_secret",
          "configuration_path": "/clusters/*/upstream_tls/certificate_chain_secret",
          "title": "Client certificate secret",
          "summary": "The deployment-secret filename containing the client certificate chain used for upstream mTLS.",
          "secret_reference": true,
          "value": {
            "kind": "string",
            "pattern": "^[A-Za-z0-9][A-Za-z0-9._-]{0,127}$"
          }
        },
        {
          "payload_path": "/upstream_tls/private_key_secret",
          "configuration_path": "/clusters/*/upstream_tls/private_key_secret",
          "title": "Client private-key secret",
          "summary": "The deployment-secret filename containing the private key used for upstream mTLS.",
          "secret_reference": true,
          "value": {
            "kind": "string",
            "pattern": "^[A-Za-z0-9][A-Za-z0-9._-]{0,127}$"
          }
        },
        {
          "payload_path": "/upstream_tls/server_name",
          "configuration_path": "/clusters/*/upstream_tls/server_name",
          "title": "TLS server name",
          "summary": "The expected upstream server identity used for SNI and certificate verification.",
          "secret_reference": false,
          "value": {
            "kind": "string",
            "min_length": 1,
            "max_length": 253,
            "pattern": "^[A-Za-z0-9](?:[A-Za-z0-9.-]*[A-Za-z0-9])?$"
          }
        },
        {
          "payload_path": "/upstream_tls/trust_bundle_secret",
          "configuration_path": "/clusters/*/upstream_tls/trust_bundle_secret",
          "title": "Upstream trust-bundle secret",
          "summary": "The deployment-secret filename containing trusted certificate authorities for the upstream server.",
          "secret_reference": true,
          "value": {
            "kind": "string",
            "pattern": "^[A-Za-z0-9][A-Za-z0-9._-]{0,127}$"
          }
        }
      ]
    },
    {
      "id": "document-local-baseline",
      "title": "Local gateway baseline",
      "summary": "Start a complete local listener, fixed response, proxied route, upstream cluster and bounded runtime profile.",
      "category": "baseline",
      "source": {
        "path": "config/examples/local.yaml",
        "pointer": "",
        "sha256": "f8fd66340d769ee505e4135e0cabd713e338b9fc8323ba1d9c21e28ecc03e4a8"
      },
      "insertion": {
        "container_path": "",
        "mode": "replace-document"
      },
      "payload": {
        "server": {
          "node_id": "bonvoyage-local",
          "admin_addr": "127.0.0.1:9901",
          "metrics_addr": "127.0.0.1:9090"
        },
        "snapshot": {
          "schema_version": 1,
          "snapshot_id": "local-bootstrap",
          "generation": 1,
          "minimum_dataplane_version": "0.2.0"
        },
        "listeners": [
          {
            "name": "http",
            "address": "0.0.0.0",
            "port": 8080,
            "protocol": "http1",
            "virtual_hosts": [
              "default"
            ]
          }
        ],
        "virtual_hosts": [
          {
            "name": "default",
            "domains": [
              "*"
            ],
            "routes": [
              {
                "name": "local-response",
                "match": {
                  "path_exact": "/bonvoyage/ready"
                },
                "fixed_response": {
                  "status_code": 200,
                  "body": "ready\n",
                  "content_type": "text/plain"
                }
              },
              {
                "name": "default-route",
                "match": {
                  "path_prefix": "/"
                },
                "cluster": "local-upstream"
              }
            ]
          }
        ],
        "clusters": [
          {
            "name": "local-upstream",
            "load_balancing_policy": "round_robin",
            "connect_timeout_ms": 1000,
            "max_connections_per_shard": 128,
            "max_pending_requests_per_shard": 256,
            "endpoints": [
              {
                "name": "upstream-1",
                "address": "upstream",
                "port": 8081,
                "weight": 1
              }
            ]
          }
        ],
        "runtime_limits": {
          "max_downstream_connections_per_shard": 16384,
          "max_request_header_bytes": 32768,
          "max_request_body_bytes": 10485760,
          "max_upstream_response_header_bytes": 32768,
          "max_upstream_chunk_metadata_bytes": 32768,
          "request_timeout_ms": 15000,
          "downstream_idle_timeout_ms": 60000
        }
      },